{
  "version": 1,
  "updatedAt": "2026-09-14",
  "oppositionId": "OPP-GSI",
  "simulations": 4,
  "cases": [
    {
      "id": "GSI-S1-A",
      "simulation": 1,
      "option": "A",
      "title": "Opción A — Nueva plataforma de ayudas y subvenciones",
      "statement": "Un organismo estatal debe sustituir una aplicación de solicitud de ayudas que actualmente solo permite descargar un PDF y presentarlo por registro. El nuevo sistema atenderá a ciudadanía, representantes y personal tramitador. En campaña se esperan hasta 45.000 solicitudes diarias, con picos de 1.200 usuarios concurrentes. Cada expediente contendrá formularios, justificantes, documentos firmados, consultas a datos de otras Administraciones cuando exista habilitación, subsanaciones y notificaciones. El sistema deberá permitir guardar borradores, presentar una solicitud con justificante de registro, consultar el estado y tramitar internamente mediante un flujo con varios estados y unidades responsables.\n\nLa dirección tecnológica propone «microservicios en cloud» como requisito de partida, aunque el equipo actual mantiene con soltura aplicaciones Java empresariales y dispone de una plataforma corporativa de contenedores. El organismo ya utiliza servicios comunes de identificación/firma y dispone de un gestor documental corporativo. La base histórica contiene 7 millones de expedientes en un modelo relacional y debe conservarse la trazabilidad. El servicio se considera relevante: se desea una disponibilidad mensual del 99,9 %, p95 inferior a 2 segundos para operaciones ordinarias y recuperación ante desastre con RTO de 4 horas y RPO de 30 minutos. El portal será utilizado desde móvil y escritorio y debe ser accesible. Los datos incluyen información personal y documentos justificativos.\n\nEl proyecto debe entrar en producción en 10 meses. Habrá un proveedor externo de desarrollo, pero la explotación será asumida por el organismo. La dirección quiere entregas parciales cada 6-8 semanas y exige que la solución pueda evolucionar sin quedar cautiva de un proveedor o una plataforma concreta.\n\n",
      "questions": [
        {
          "id": "1",
          "prompt": "Identifique y priorice los requisitos funcionales, no funcionales, restricciones y actores principales. Proponga cómo obtendría, especificaría y mantendría la trazabilidad de los requisitos, incluyendo los derivados del sistema actual.",
          "checklist": []
        },
        {
          "id": "2",
          "prompt": "Proponga la arquitectura lógica de la solución y justifique si utilizaría monolito modular, microservicios u otra combinación. Describa capas/componentes, integraciones, persistencia, gestión documental, flujo de expediente y mecanismos de escalado y disponibilidad.",
          "checklist": []
        },
        {
          "id": "3",
          "prompt": "Defina el modelo de seguridad y cumplimiento: identificación y firma, autorización, protección de datos, seguridad de aplicación, ENS/ENI cuando procedan, accesibilidad y evidencias de auditoría. Indique además qué controles deben integrarse desde el desarrollo.",
          "checklist": []
        },
        {
          "id": "4",
          "prompt": "Plantee la estrategia de construcción, integración continua, pruebas, despliegue y transición a operación. Debe contemplar pruebas funcionales y no funcionales, datos de prueba, accesibilidad, seguridad, rendimiento, recuperación y rollback.",
          "checklist": []
        },
        {
          "id": "5",
          "prompt": "Proponga el plan de implantación y migración en 10 meses: metodología y gobierno, hitos, estrategia de sustitución, migración/reconciliación de datos, formación, gestión de riesgos y métricas de éxito postimplantación. Incluya cómo analizaría viabilidad/TCO y reversibilidad.",
          "checklist": []
        }
      ],
      "checklist": [
        "Subraya datos cuantitativos, restricciones, SLA/RPO/RTO, actores e integraciones.",
        "Distingue hechos del enunciado de tus propias asunciones.",
        "No “compres” tecnologías con siglas: cada componente debe resolver un requisito o riesgo.",
        "Si haces un cálculo, escribe fórmula, unidades, resultado e interpretación.",
        "Reserva espacio para seguridad, operación, pruebas y recuperación cuando sean relevantes."
      ],
      "rubric": {
        "technical": 30,
        "analysis": 10,
        "systematic": 5,
        "expression": 5
      },
      "source": {
        "title": "GSI A2 — PRÁCTICA ACTIVA 13 — SIMULACROS COMPLETOS MIXTOS — CUADERNO",
        "url": "https://docs.google.com/document/d/1_T7Ivn0ZkXePGGA9emuOMoV4e9mutHgZZ9YkXhVejwY/edit",
        "drive_id": "1_T7Ivn0ZkXePGGA9emuOMoV4e9mutHgZZ9YkXhVejwY",
        "type": "curated",
        "locator": "Simulacro 1, Opción A — Nueva plataforma de ayudas y subvenciones; índice nativo 2146"
      },
      "solutionHtml": "<p><strong>Mapa temático oculto:</strong> Bloque I (administración electrónica, identificación/firma, protección de datos, ENS/ENI y servicios comunes); II.05-II.07, II.10, II.15-II.16; III.01-III.04, III.06-III.08, III.12-III.14; IV.03-IV.04/IV.06.</p>\n<p><strong>Qué está buscando el corrector:</strong> Se busca una solución de servicio público completa, no una decisión de framework. Debe existir continuidad lógica entre requisitos, arquitectura, datos/documentos, seguridad, accesibilidad, pruebas, migración y operación.</p>\n<h3>Arquitectura mental antes de escribir</h3>\n<p>Ciudadanía/representante → portal accesible → identidad/firma → API/backend modular → workflow/expediente → BD + gestor documental → servicios comunes; transversal: seguridad, observabilidad, CI/CD, backup/DR.</p>\n<h3>Pregunta 1 — Identifique y priorice los requisitos funcionales, no funcionales, restricciones y actores principales. Proponga cómo obtendría, especificaría y mantendría la trazabilidad de los requisitos, incluyendo los derivados del sistema actual.</h3>\n<p>Distinguir actores: ciudadanía, representante, tramitador, responsable/unidad, administración del sistema y sistemas externos. Requisitos funcionales: borrador, presentación, anexos, firma cuando proceda, registro/justificante, consulta de estado, subsanación, tramitación por estados, notificación e integración. NFR medibles: 99,9 %, p95 &lt;2 s bajo carga definida, concurrencia, RTO 4 h/RPO 30 min, seguridad, accesibilidad, auditabilidad, escalabilidad, mantenibilidad y reversibilidad. Restricciones: servicios comunes, gestor documental corporativo, datos históricos y explotación interna. Elicitación con entrevistas/talleres, observación, análisis documental y del sistema actual, logs/datos, prototipos y mapa as-is/to-be. Separar requisito real de limitación heredada. SRS/backlog con criterios de aceptación y matriz necesidad→requisito→diseño→prueba→release.</p>\n<h3>Pregunta 2 — Proponga la arquitectura lógica de la solución y justifique si utilizaría monolito modular, microservicios u otra combinación. Describa capas/componentes, integraciones, persistencia, gestión documental, flujo de expediente y mecanismos de escalado y disponibilidad.</h3>\n<p>Arquitectura por capas: front web responsive/accesible; API/backend; módulos de negocio; motor de workflow o gestión de estados; adaptadores a identidad/firma/registro/notificación y otras consultas; gestor documental externo; BD relacional para transacciones; caché/broker solo si resuelven requisitos; observabilidad transversal. No aceptar &#x27;microservicios&#x27; como requisito: con 10 meses, equipo Java y dominio aún por estabilizar, un monolito modular desplegado en contenedores puede reducir complejidad y preservar límites claros; extraer servicios solo cuando haya escalado, ciclo de vida o aislamiento de fallo independiente. Balanceo/replicas stateless y escalado horizontal; BD con HA/backup/PITR según RPO/RTO. Contratos versionados e idempotencia en presentación/notificación para evitar dobles efectos.</p>\n<h3>Pregunta 3 — Defina el modelo de seguridad y cumplimiento: identificación y firma, autorización, protección de datos, seguridad de aplicación, ENS/ENI cuando procedan, accesibilidad y evidencias de auditoría. Indique además qué controles deben integrarse desde el desarrollo.</h3>\n<p>Identidad/firma mediante servicios corporativos aplicables y autorización por roles/atributos; mínimo privilegio y segregación. TLS, gestión de secretos, validación server-side, parametrización, control de acceso, protección de sesión/tokens, rate limiting, logging sin exponer datos y seguridad de dependencias. Protección de datos desde diseño: finalidad, minimización, acceso, retención y trazabilidad. ENS basado en riesgo y ENI/NTI/interoperabilidad cuando proceda; expediente/documento con metadatos y evidencias. Accesibilidad desde requisitos: HTML semántico, teclado/foco, labels/errores, contraste, alternativas y pruebas automáticas+manuales; no dejarla para el final. Auditoría de acciones relevantes con identidad, fecha, acción y resultado, protegiendo logs. DevSecOps con SAST/SCA/secret scanning e infraestructura/configuración revisable.</p>\n<h3>Pregunta 4 — Plantee la estrategia de construcción, integración continua, pruebas, despliegue y transición a operación. Debe contemplar pruebas funcionales y no funcionales, datos de prueba, accesibilidad, seguridad, rendimiento, recuperación y rollback.</h3>\n<p>Pipeline: control de versiones→build reproducible→análisis estático/SAST/SCA→unitarias→integración/API→empaquetado/imagen→pruebas sistema→performance/security/accessibility→promoción del mismo artefacto. Datos sintéticos/anonimizados cuando sea viable; datasets versionados. Pruebas de software, datos migrados, procedimientos (backup/restore, cambio, certificados, DR) y aceptación. Carga/estrés/soak en campaña; accesibilidad automática+manual; DAST/pentest según riesgo. Despliegue rolling/blue-green/canary si arquitectura lo permite; migraciones de BD compatibles hacia delante/atrás o expand-contract. Heal